<?xml version="1.0" encoding="UTF-8"?>
<xs:schema xmlns:xs="http://www.w3.org/2001/XMLSchema"
           targetNamespace="http://skoona.net/SknServices/ContentRegistry"
           xmlns="http://skoona.net/SknServices/ContentRegistry" >
           
  <xs:element name="contentRegistry">
    <xs:complexType>
      <xs:sequence>
        <xs:element ref="resource" maxOccurs="unbounded" minOccurs="0">
          <xs:annotation>
            <xs:documentation><![CDATA[config/content_registry.xml

               * REQUIRED RESOURCE SYNTAX **********************************************
                                  ** Note: :options are now required for TopicOpts values

                <resource secured="true|false" content="true|false" topicValueRegex="">
                    <uri>CONTENT/TOPIC/TOPIC_VALUE</uri>
                    <description></description>
                    <userdata>CONTENT_VALUE</userdata>
                    <permission type="READ">
                        <authorizedRoles>
                            <authorizedRole options="TOPIC_VALUE RequiredCommaSepTopicValues">Services.CONTENT.TOPIC.Access</authorizedRole>
                        </authorizedRoles>
                    </permission>
                </resource>

                UserData Required format/syntax is:
                   returns Array if value|value,...
                   returns Hash  if key:value|key:value|...
                   returns String if no reserve chars present
                   Reserved chars: |:  # vertical-bar and semi-colon


               ============== Content Access Adaptation  ==========]]>
            </xs:documentation>
          </xs:annotation>
        </xs:element>
      </xs:sequence>
    </xs:complexType>
  </xs:element>
    
  <xs:element name="authorizedRole">
    <xs:complexType>
      <xs:simpleContent>
        <xs:extension base="xs:string">
          <xs:attribute type="xs:string" name="options" use="required"/>
        </xs:extension>
      </xs:simpleContent>
    </xs:complexType>
  </xs:element>
  
  <xs:element name="authorizedRoles">
    <xs:complexType>
      <xs:sequence>
        <xs:element ref="authorizedRole" maxOccurs="unbounded"/>
      </xs:sequence>
    </xs:complexType>
  </xs:element>
  
  <xs:element name="permission">
    <xs:complexType>
      <xs:sequence>
        <xs:element ref="authorizedRoles"/>
      </xs:sequence>
      <xs:attribute name="type" use="required">
        <xs:simpleType>
          <xs:restriction base="xs:string">
            <xs:enumeration value="READ" />
          </xs:restriction>
        </xs:simpleType>
      </xs:attribute>
    </xs:complexType>
  </xs:element>
  
  <xs:element name="uri">
    <xs:simpleType>
      <xs:restriction base="xs:string">
        <xs:pattern value="\w+/\w+/\w+" />
      </xs:restriction>
    </xs:simpleType>
  </xs:element>

  <xs:element name="description" type="xs:string" />
  <xs:element name="userdata" type="xs:string"/>
  
  <xs:element name="resource">
    <xs:complexType>
      <xs:sequence>
        <xs:element ref="uri"/>
        <xs:element ref="description"/>
        <xs:element ref="userdata"/>
        <xs:element ref="permission" maxOccurs="4" minOccurs="1"/>
      </xs:sequence>
      <xs:attribute type="xs:boolean" name="secured" use="required"/>
      <xs:attribute type="xs:boolean" name="content" use="required"/>
      <xs:attribute type="xs:string" name="topicValueRegex" />
    </xs:complexType>
  </xs:element>
</xs:schema>